{
  "schema_version": "1.1",
  "connector_id": "synthetic-people-search",
  "version": "0.1.0",
  "broker": {
    "id": "synthetic-people-search",
    "name": "Synthetic People Search",
    "category": "people_search",
    "jurisdictions": ["US-TEST"]
  },
  "destinations": [
    {"origin": "https://broker.example.test", "purpose": "observe", "allow_subdomains": false, "methods": ["GET"], "protocols": ["https"], "redirect_limit": 1, "max_response_bytes": 262144},
    {"origin": "https://privacy.example.test", "purpose": "submit", "allow_subdomains": false, "methods": ["POST"], "protocols": ["https"], "redirect_limit": 0, "max_response_bytes": 65536},
    {"origin": "https://broker.example.test", "purpose": "verify", "allow_subdomains": false, "methods": ["GET"], "protocols": ["https"], "redirect_limit": 1, "max_response_bytes": 262144}
  ],
  "capabilities": [
    {
      "name": "observe",
      "transport": "http",
      "identity_attributes": [
        {"type": "name", "requirement": "required", "reason": "Synthetic record lookup"},
        {"type": "address", "requirement": "optional", "reason": "Disambiguate matching synthetic names"}
      ],
      "automation": "observe_only",
      "maturity": "observe-tested",
      "rate_limit": {"max_actions": 2, "period_seconds": 60},
      "limitations": ["Synthetic fixture only; never a live broker"]
    },
    {
      "name": "submit",
      "transport": "http",
      "identity_attributes": [
        {"type": "broker_record_id", "requirement": "required", "reason": "Target the confirmed synthetic record"},
        {"type": "email", "requirement": "required", "reason": "Receive synthetic confirmation"}
      ],
      "automation": "approval_required",
      "maturity": "experimental",
      "rate_limit": {"max_actions": 1, "period_seconds": 300},
      "limitations": ["Synthetic fixture only; never a live broker"]
    }
  ],
  "provenance": [
    {"url": "https://privacy.example.test", "observed_at": "2026-07-15T00:00:00Z", "kind": "manual_observation", "license_or_terms": "Synthetic fixture authored for MyCogni under Apache-2.0"}
  ],
  "artifact": {
    "digest": "sha256:0000000000000000000000000000000000000000000000000000000000000000",
    "runtime": "oci",
    "provenance_ref": "https://build.example.test/synthetic-people-search/provenance.json",
    "sbom_ref": "https://build.example.test/synthetic-people-search/sbom.json",
    "signature_policy": "development-local"
  },
  "review": {
    "status": "observe-tested",
    "reviewed_at": "2026-07-15T00:00:00Z",
    "expires_at": "2027-01-15T00:00:00Z",
    "reviewers": ["architecture-inception"]
  }
}
